{
  "schema_version": "1.1",
  "task_id": "task-bid-0001",
  "request_id": "req-1.1-offer",
  "tool_name": "access.remote_sensing_access",
  "status": "succeeded",
  "node_id": "sat-B/intelligent",
  "mission_id": "m-0001",
  "candidates": [
    {
      "window": {
        "start_utc": "2026-12-30T01:00:00Z",
        "end_utc": "2026-12-30T01:03:20Z",
        "t0_utc": "2026-12-30T01:01:40Z"
      },
      "node_id": "sat-B/intelligent",
      "cost": 3600.0,
      "capability": {
        "kind": "compute"
      }
    }
  ]
}
