{
  "schema_version": "1.1",
  "task_id": "task-0001",
  "request_id": "req-1.1-rd",
  "tool_name": "task-manager",
  "status": "succeeded",
  "node_id": "sat-B/intelligent",
  "mission_id": "m-0001",
  "candidates": [
    {
      "window": {
        "start_utc": "2026-12-30T01:00:00Z",
        "end_utc": "2026-12-30T01:03:20Z",
        "t0_utc": "2026-12-30T01:01:40Z"
      },
      "node_id": "sat-B/intelligent",
      "cost": 3600.0
    }
  ],
  "follow_ups": [
    {
      "envelope": {
        "schema_version": "1.1",
        "message_type": "task.forward",
        "request_id": "req-1.1-fwd"
      }
    }
  ]
}
