{
  "schema_version": "1.1",
  "task_id": "task-deliver-0001",
  "request_id": "req-1.1-receipt",
  "tool_name": "net.deliver",
  "status": "succeeded",
  "node_id": "sat-B/intelligent",
  "mission_id": "m-0001",
  "step_id": "S8",
  "receipts": [
    {
      "delivered_at_utc": "2026-12-30T02:00:00Z",
      "via": "net.deliver",
      "receiver": {
        "ip": "10.0.3.7",
        "lla": {
          "lon_deg": 116.4,
          "lat_deg": 39.9,
          "alt_km": 0.03
        }
      },
      "mission_id": "m-0001",
      "step_id": "S8",
      "idempotency_key": "receipt-m-0001-S8"
    }
  ]
}
